{
  "schema_version": "1.0",
  "id": "ctx_01K5V8H3Z0A1B2C3D4E5F6G7H8",
  "kind": "brief",
  "status": "draft",
  "scope": {
    "repository": "github.com/disler/fusion-harness",
    "branch": "feature/icm",
    "commit": "5852f2e0000000000000000000000000deadbeef",
    "task_id": "task_01K5V8H3Z0A1B2C3D4E5F6G7H0",
    "run_id": "run_01K5V8H3Z0A1B2C3D4E5F6G7H1"
  },
  "producer": { "role": "user", "model": "human", "created_at": "2026-09-23T18:00:00.000Z" },
  "summary": "Add a --version flag to the CLI that prints the package version and exits 0.",
  "requirements": ["Add a --version flag to the CLI that prints the package version and exits 0."],
  "decisions": ["command: /auto-validate", "architect: anthropic/claude-sonnet-5 (medium)", "builder: openai/gpt-5.6-terra (medium)"],
  "risks": [],
  "acceptance_criteria": ["The VALIDATOR-authored gate.py exits 0 against the working tree."],
  "claims": [],
  "artifacts": [{ "path": "prompt.md", "type": "prompt", "sha256": "ba7816bf8f01cfea414140de5dae2223b00361a396177a9cb410ff61f20015ad" }],
  "open_questions": [],
  "supersedes": null
}
