{
  "schema_version": "1.0",
  "id": "ctx_01K5V8H3Z0A1B2C3D4E5F6G7HC",
  "kind": "output",
  "status": "draft",
  "scope": {
    "repository": "github.com/disler/fusion-harness",
    "branch": "feature/icm",
    "commit": "5852f2e0000000000000000000000000deadbeef",
    "task_id": "task_01K5V8H3Z0A1B2C3D4E5F6G7H0",
    "run_id": "run_01K5V8H3Z0A1B2C3D4E5F6G7H1"
  },
  "producer": { "role": "harness", "model": "harness/fusion-harness", "created_at": "2026-09-23T18:09:00.000Z" },
  "summary": "Gate PASS at validation 2/5.",
  "requirements": [],
  "decisions": ["Phase 1 observe-only: envelope status stays draft; no durable promotion."],
  "risks": [],
  "acceptance_criteria": ["gate.py exits 0"],
  "claims": [
    {
      "statement": "The acceptance gate passed.",
      "status": "validated",
      "source_role": "validator",
      "evidence": ["envelope:ctx_01K5V8H3Z0A1B2C3D4E5F6G7HD", "artifact:gate-round-2.txt", "commit:5852f2e0000000000000000000000000deadbeef"],
      "validated_by": "gate"
    }
  ],
  "artifacts": [{ "path": "gate-round-2.txt", "type": "gate-output", "sha256": "ba7816bf8f01cfea414140de5dae2223b00361a396177a9cb410ff61f20015ad" }],
  "open_questions": ["Baseline also passed — verify the gate is not weak."],
  "supersedes": null
}
