{
  "schema_version": "1.0",
  "id": "ctx_01K5V8H3Z0A1B2C3D4E5F6G7HB",
  "kind": "validation",
  "status": "draft",
  "scope": {
    "repository": "github.com/disler/fusion-harness",
    "branch": "feature/icm",
    "commit": "5852f2e0000000000000000000000000deadbeef",
    "task_id": "task_01K5V8H3Z0A1B2C3D4E5F6G7H0",
    "run_id": "run_01K5V8H3Z0A1B2C3D4E5F6G7H1"
  },
  "producer": { "role": "validator", "model": "anthropic/claude-sonnet-5", "created_at": "2026-09-23T18:05:30.000Z" },
  "summary": "Gate run 1/5: FAIL (exit 1). 1 of 2 checks failed.",
  "requirements": [],
  "decisions": ["exit 1"],
  "risks": [],
  "acceptance_criteria": ["gate.py exits 0"],
  "claims": [
    {
      "statement": "The acceptance gate passed.",
      "status": "rejected",
      "source_role": "validator",
      "evidence": ["artifact:gate-round-1.txt", "artifact:gate.py"],
      "validated_by": "gate"
    }
  ],
  "artifacts": [
    { "path": "gate.py", "type": "gate-script", "sha256": "ba7816bf8f01cfea414140de5dae2223b00361a396177a9cb410ff61f20015ad" },
    { "path": "gate-round-1.txt", "type": "gate-output", "sha256": "ba7816bf8f01cfea414140de5dae2223b00361a396177a9cb410ff61f20015ad" }
  ],
  "open_questions": [],
  "supersedes": null
}
